{
    "$schema": "../../../schema/plugin.schema.json",
    "name": "tee-security-auditor",
    "version": "1.0.0",
    "description": "Expert TEE security auditor for Intel TDX attestation, DCAP verification, EKM channel binding, and aTLS implementations.",
    "author": {
        "name": "Concrete Security Team",
        "email": "contact@concrete-security.com"
    },
    "license": "",
    "repository": "https://github.com/concrete-security/concrete-marketplace",
    "keywords": [
        "TEE",
        "TDX",
        "attestation",
        "DCAP",
        "security",
        "aTLS"
    ]
}
