{
    "$schema": "../../../schema/plugin.schema.json",
    "name": "tee-experts",
    "version": "0.1.0",
    "description": "Develop, test, and secure Trusted Execution Environment (TEE) applications with expert agents for TDX attestation, DCAP verification, and aTLS.",
    "author": {
        "name": "Concrete Security Team",
        "email": "contact@concrete-security.com"
    },
    "license": "",
    "repository": "https://github.com/concrete-security/concrete-marketplace",
    "keywords": [
        "TEE",
        "TDX",
        "attestation",
        "DCAP",
        "security",
        "aTLS"
    ]
}
